-- hybrid_test.sql
-- Regression tests for hybrid BM25 + dense vector search feature.
---------------------------------------------------------------------------
-- Setup
---------------------------------------------------------------------------
CREATE TABLE hybrid_test_docs (
    id      BIGSERIAL PRIMARY KEY,
    content TEXT
);
-- Use a fixed embedding dimension to avoid needing an API key
SELECT pgedge_vectorizer.enable_vectorization(
    'hybrid_test_docs'::regclass,
    'content',
    'token_based',
    100,
    10,
    1536
);
NOTICE:  Using primary key column: id (bigint)
NOTICE:  column "sparse_embedding" of relation "hybrid_test_docs_content_chunks" already exists, skipping
NOTICE:  Vectorization enabled: hybrid_test_docs -> hybrid_test_docs_content_chunks
NOTICE:  Strategy: token_based, chunk_size: 100, overlap: 10
NOTICE:  Processing existing rows...
NOTICE:  Processed 0 existing rows
 enable_vectorization 
----------------------
 
(1 row)

---------------------------------------------------------------------------
-- Test 1: GUC parameters exist
---------------------------------------------------------------------------
-- Verify all three hybrid GUC params are registered
SELECT name
FROM pg_settings
WHERE name IN (
    'pgedge_vectorizer.enable_hybrid',
    'pgedge_vectorizer.bm25_k1',
    'pgedge_vectorizer.bm25_b'
)
ORDER BY name;
              name               
---------------------------------
 pgedge_vectorizer.bm25_b
 pgedge_vectorizer.bm25_k1
 pgedge_vectorizer.enable_hybrid
(3 rows)

---------------------------------------------------------------------------
-- Test 2: sparse_embedding column exists in chunk table
---------------------------------------------------------------------------
SELECT column_name, data_type
FROM information_schema.columns
WHERE table_name   = 'hybrid_test_docs_content_chunks'
  AND column_name  = 'sparse_embedding';
   column_name    |  data_type   
------------------+--------------
 sparse_embedding | USER-DEFINED
(1 row)

---------------------------------------------------------------------------
-- Test 3: token_count column exists in chunk table (used for BM25 doc length)
---------------------------------------------------------------------------
SELECT column_name, data_type
FROM information_schema.columns
WHERE table_name  = 'hybrid_test_docs_content_chunks'
  AND column_name = 'token_count';
 column_name | data_type 
-------------+-----------
 token_count | integer
(1 row)

---------------------------------------------------------------------------
-- Test 4: IDF stats table was created
---------------------------------------------------------------------------
SELECT tablename
FROM pg_tables
WHERE tablename = 'hybrid_test_docs_content_chunks_idf_stats';
                 tablename                 
-------------------------------------------
 hybrid_test_docs_content_chunks_idf_stats
(1 row)

---------------------------------------------------------------------------
-- Test 5: HNSW sparse index was created
---------------------------------------------------------------------------
SELECT indexname
FROM pg_indexes
WHERE tablename = 'hybrid_test_docs_content_chunks'
  AND indexname LIKE '%sparse%';
                 indexname                  
--------------------------------------------
 hybrid_test_docs_content_chunks_sparse_idx
(1 row)

---------------------------------------------------------------------------
-- Test 6: vectorizers registry was populated
---------------------------------------------------------------------------
SELECT source_table, source_column, chunk_table
FROM pgedge_vectorizer.vectorizers
WHERE source_table = 'hybrid_test_docs';
   source_table   | source_column |           chunk_table           
------------------+---------------+---------------------------------
 hybrid_test_docs | content       | hybrid_test_docs_content_chunks
(1 row)

---------------------------------------------------------------------------
-- Test 7: hybrid_search function exists
---------------------------------------------------------------------------
SELECT proname
FROM pg_proc
WHERE proname = 'hybrid_search'
  AND pronamespace = (
      SELECT oid FROM pg_namespace
      WHERE nspname = 'pgedge_vectorizer'
  );
    proname    
---------------
 hybrid_search
(1 row)

---------------------------------------------------------------------------
-- Test 8: hybrid_search_simple function exists
---------------------------------------------------------------------------
SELECT proname
FROM pg_proc
WHERE proname = 'hybrid_search_simple'
  AND pronamespace = (
      SELECT oid FROM pg_namespace
      WHERE nspname = 'pgedge_vectorizer'
  );
       proname        
----------------------
 hybrid_search_simple
(1 row)

---------------------------------------------------------------------------
-- Test 9: BM25 tokenizer returns non-empty output for normal text
---------------------------------------------------------------------------
SELECT array_length(
    pgedge_vectorizer.bm25_tokenize('the quick brown fox jumps'),
    1
) > 0 AS has_tokens;
 has_tokens 
------------
 t
(1 row)

---------------------------------------------------------------------------
-- Test 10: BM25 tokenizer strips stopwords
-- 'the', 'is', 'a' are stopwords; 'cat' and 'test' should remain
---------------------------------------------------------------------------
SELECT token
FROM unnest(pgedge_vectorizer.bm25_tokenize('the cat is a test')) AS token
ORDER BY token;
 token 
-------
 cat
 test
(2 rows)

---------------------------------------------------------------------------
-- Test 11: BM25 tokenizer handles empty string
---------------------------------------------------------------------------
SELECT COALESCE(
    array_length(pgedge_vectorizer.bm25_tokenize(''), 1),
    0
) AS token_count;
 token_count 
-------------
           0
(1 row)

---------------------------------------------------------------------------
-- Test 12: hybrid_search raises a clear exception for unknown table
---------------------------------------------------------------------------
SET pgedge_vectorizer.enable_hybrid = true;
DO $$
BEGIN
    PERFORM pgedge_vectorizer.hybrid_search(
        'pg_class'::regclass, 'test query', 5
    );
    RAISE EXCEPTION 'Expected exception was not raised';
EXCEPTION
    WHEN OTHERS THEN
        IF sqlerrm LIKE '%No vectorizer found%' THEN
            RAISE NOTICE 'Got expected exception: %', sqlerrm;
        ELSE
            RAISE;
        END IF;
END;
$$;
NOTICE:  Got expected exception: No vectorizer found for table pg_class. Call pgedge_vectorizer.enable_vectorization() first.
RESET pgedge_vectorizer.enable_hybrid;
---------------------------------------------------------------------------
-- Test 13: hybrid_search raises when enable_hybrid is false
---------------------------------------------------------------------------
-- Explicitly disable so the test is deterministic regardless of postgresql.conf
SET pgedge_vectorizer.enable_hybrid = false;
DO $$
BEGIN
    PERFORM pgedge_vectorizer.hybrid_search(
        'hybrid_test_docs'::regclass, 'test query', 5
    );
    RAISE EXCEPTION 'Expected exception was not raised';
EXCEPTION
    WHEN OTHERS THEN
        IF sqlerrm LIKE '%Hybrid search is disabled%' THEN
            RAISE NOTICE 'Got expected exception: %', sqlerrm;
        ELSE
            RAISE;
        END IF;
END;
$$;
NOTICE:  Got expected exception: Hybrid search is disabled. Set pgedge_vectorizer.enable_hybrid = true and allow workers to populate sparse_embedding.
RESET pgedge_vectorizer.enable_hybrid;
---------------------------------------------------------------------------
-- Test 14: bm25_query_vector returns a non-null sparsevec
---------------------------------------------------------------------------
SELECT pg_typeof(
    pgedge_vectorizer.bm25_query_vector(
        'quick brown fox',
        'hybrid_test_docs_content_chunks'
    )
)::text AS result_type;
 result_type 
-------------
 sparsevec
(1 row)

---------------------------------------------------------------------------
-- Test 15: bm25_avg_doc_len returns a sensible default for an empty table
---------------------------------------------------------------------------
SELECT pgedge_vectorizer.bm25_avg_doc_len(
    'hybrid_test_docs_content_chunks'
) >= 0 AS non_negative;
 non_negative 
--------------
 t
(1 row)

---------------------------------------------------------------------------
-- Test 15b: bm25_avg_doc_len equals the actual average
---------------------------------------------------------------------------
-- AVG() over an integer column yields numeric, so reading its Datum as a
-- float8 without a cast gives a denormal rather than the mean.  ">= 0" above
-- cannot catch that: a denormal is positive.  Compare against the value SQL
-- computes, on a table with rows in it.
CREATE TABLE avg_len_docs (id BIGSERIAL PRIMARY KEY, body TEXT);
INSERT INTO avg_len_docs (body)
SELECT repeat('alpha beta gamma delta ', 40) FROM generate_series(1, 5);
SELECT pgedge_vectorizer.enable_vectorization('avg_len_docs', 'body',
                                              embedding_dimension => 3);
NOTICE:  Using primary key column: id (bigint)
NOTICE:  column "sparse_embedding" of relation "avg_len_docs_body_chunks" already exists, skipping
NOTICE:  Vectorization enabled: avg_len_docs -> avg_len_docs_body_chunks
NOTICE:  Strategy: token_based, chunk_size: 400, overlap: 50
NOTICE:  Processing existing rows...
NOTICE:  Processed 5 existing rows
 enable_vectorization 
----------------------
 
(1 row)

SELECT pgedge_vectorizer.bm25_avg_doc_len('avg_len_docs_body_chunks')
       = (SELECT AVG(token_count)::float8 FROM avg_len_docs_body_chunks)
       AS avg_doc_len_matches_sql;
 avg_doc_len_matches_sql 
-------------------------
 t
(1 row)

-- and it must be a plausible document length, not a denormal
SELECT pgedge_vectorizer.bm25_avg_doc_len('avg_len_docs_body_chunks') > 1.0
       AS avg_doc_len_is_realistic;
 avg_doc_len_is_realistic 
--------------------------
 t
(1 row)

SELECT pgedge_vectorizer.disable_vectorization('avg_len_docs', 'body', true);
NOTICE:  Vectorization disabled and chunk table dropped: avg_len_docs_body_chunks
 disable_vectorization 
-----------------------
 
(1 row)

DROP TABLE avg_len_docs;
---------------------------------------------------------------------------
-- Test 15c: a missing chunk table is reported, not absorbed
---------------------------------------------------------------------------
-- The stats load runs in a subtransaction that tolerates a missing table,
-- which is right for the stats table (not vectorized yet) but wrong for the
-- chunk table, where it means the registry points at something that is gone.
-- Reading the corpus figures inside that subtransaction would swallow it and
-- return a silently degraded vector.
CREATE TABLE orphan_idf_stats (
    term TEXT PRIMARY KEY,
    doc_freq INT,
    updated_at TIMESTAMPTZ DEFAULT now()
);
INSERT INTO orphan_idf_stats (term, doc_freq) VALUES ('alpha', 1), ('beta', 1);
DO $$
BEGIN
    PERFORM pgedge_vectorizer.bm25_query_vector('alpha beta', 'orphan');
    RAISE EXCEPTION 'Expected exception was not raised';
EXCEPTION
    WHEN undefined_table THEN
        RAISE NOTICE 'Got expected exception for missing chunk table';
END;
$$;
NOTICE:  Got expected exception for missing chunk table
DROP TABLE orphan_idf_stats;
---------------------------------------------------------------------------
-- Test 16: BM25 tokenizer returns empty array for NULL input
---------------------------------------------------------------------------
SELECT COALESCE(
    array_length(pgedge_vectorizer.bm25_tokenize(NULL), 1),
    0
) AS token_count;
 token_count 
-------------
           0
(1 row)

---------------------------------------------------------------------------
-- Test 17: BM25 tokenizer returns empty array for all-stopword input
---------------------------------------------------------------------------
SELECT COALESCE(
    array_length(pgedge_vectorizer.bm25_tokenize('the is a an and'), 1),
    0
) AS token_count;
 token_count 
-------------
           0
(1 row)

---------------------------------------------------------------------------
-- Test 17b: terms too long for the hash key are dropped, not merged
---------------------------------------------------------------------------
-- The dedup and IDF hashes both key on BM25_MAX_TERM_LEN (128) bytes, so
-- dynahash truncates anything longer. Two distinct terms sharing that much
-- of a prefix would merge into one entry with a combined term frequency and
-- a shared weight. They are dropped instead.
SELECT COALESCE(
    array_length(pgedge_vectorizer.bm25_tokenize(repeat('a', 200)), 1),
    0
) AS overlong_term_dropped;
 overlong_term_dropped 
-----------------------
                     0
(1 row)

-- Two distinct 151-character terms differing only in their last character.
-- Truncated to 127 bytes they are identical, so before this change the pair
-- collapsed to a single token.
SELECT COALESCE(
    array_length(
        pgedge_vectorizer.bm25_tokenize(
            repeat('a', 150) || 'x ' || repeat('a', 150) || 'y'),
        1),
    0
) AS overlong_pair_dropped;
 overlong_pair_dropped 
-----------------------
                     0
(1 row)

-- A term just inside the limit is still indexed
SELECT COALESCE(
    array_length(pgedge_vectorizer.bm25_tokenize(repeat('a', 127)), 1),
    0
) AS max_length_term_kept;
 max_length_term_kept 
----------------------
                    1
(1 row)

-- The other side of the boundary: two distinct terms just inside the limit
-- must stay distinct. Dropping what does not fit is only correct if nothing
-- below the limit merges, so this is what would catch a guard that shortened
-- the effective key rather than one that failed to apply.
SELECT COALESCE(
    array_length(
        pgedge_vectorizer.bm25_tokenize(
            repeat('a', 126) || 'x ' || repeat('a', 126) || 'y'),
        1),
    0
) AS max_length_pair_distinct;
 max_length_pair_distinct 
--------------------------
                        2
(1 row)

---------------------------------------------------------------------------
-- Test 18: bm25_decrement_idf_stats handles NULL/empty terms gracefully
---------------------------------------------------------------------------
-- Should return without error for NULL terms
SELECT pgedge_vectorizer.bm25_decrement_idf_stats(
    'hybrid_test_docs_content_chunks', NULL, 1
);
 bm25_decrement_idf_stats 
--------------------------
 
(1 row)

-- Should return without error for empty array
SELECT pgedge_vectorizer.bm25_decrement_idf_stats(
    'hybrid_test_docs_content_chunks', '{}'::text[], 1
);
 bm25_decrement_idf_stats 
--------------------------
 
(1 row)

---------------------------------------------------------------------------
-- Test 19: bm25_decrement_idf_stats adjusts counts correctly
---------------------------------------------------------------------------
-- Seed a term into the IDF stats table
INSERT INTO hybrid_test_docs_content_chunks_idf_stats
    (term, doc_freq)
VALUES ('testterm', 5);
-- Decrement by 1
SELECT pgedge_vectorizer.bm25_decrement_idf_stats(
    'hybrid_test_docs_content_chunks',
    ARRAY['testterm'],
    1
);
 bm25_decrement_idf_stats 
--------------------------
 
(1 row)

-- Verify the count was reduced
SELECT term, doc_freq
FROM hybrid_test_docs_content_chunks_idf_stats
WHERE term = 'testterm';
   term   | doc_freq 
----------+----------
 testterm |        4
(1 row)

-- bm25_query_vector against a populated stats table.  Test 14 calls it while
-- _idf_stats is empty, which returns early without building the IDF hash.
SELECT pgedge_vectorizer.bm25_query_vector(
    'testterm sample', 'hybrid_test_docs_content_chunks'
) IS NOT NULL AS query_vector_with_populated_stats;
 query_vector_with_populated_stats 
-----------------------------------
 t
(1 row)

-- The loader fetches only the query's own terms, so vocabulary belonging to
-- other documents must not affect the result. This guards the scoping against
-- changing output; it cannot show the resource saving, which is why the number
-- of rows loaded is not asserted here.
--
SELECT pgedge_vectorizer.bm25_query_vector(
    'testterm sample', 'hybrid_test_docs_content_chunks')::text AS baseline \gset
INSERT INTO hybrid_test_docs_content_chunks_idf_stats (term, doc_freq)
SELECT 'unrelated' || g, 1 FROM generate_series(1, 5000) g;
SELECT :'baseline'::sparsevec
       = pgedge_vectorizer.bm25_query_vector(
             'testterm sample', 'hybrid_test_docs_content_chunks')
       AS unchanged_by_unrelated_vocabulary;
 unchanged_by_unrelated_vocabulary 
-----------------------------------
 t
(1 row)

DELETE FROM hybrid_test_docs_content_chunks_idf_stats WHERE term LIKE 'unrelated%';
-- bm25_query_vector() inside a statement that owns relations. The loader runs
-- its SPI query in a subtransaction; if it does not restore the caller's
-- resource owner on release, this aborts the backend with "relcache reference
-- is not owned by resource owner". A plain SELECT does not catch it.
CREATE TABLE bm25_owner_check AS
SELECT pgedge_vectorizer.bm25_query_vector(
    'testterm sample', 'hybrid_test_docs_content_chunks') AS v;
SELECT count(*) AS rows_written FROM bm25_owner_check;
 rows_written 
--------------
            1
(1 row)

DROP TABLE bm25_owner_check;
-- Clean up the test row
DELETE FROM hybrid_test_docs_content_chunks_idf_stats WHERE term = 'testterm';
---------------------------------------------------------------------------
-- Test 20: disable_vectorization with drop_chunk_table also drops _idf_stats
---------------------------------------------------------------------------
-- Create a second vectorized column to test cleanup
CREATE TABLE hybrid_cleanup_test (
    id      BIGSERIAL PRIMARY KEY,
    body    TEXT
);
SELECT pgedge_vectorizer.enable_vectorization(
    'hybrid_cleanup_test'::regclass,
    'body',
    'token_based',
    100,
    10,
    1536
);
NOTICE:  Using primary key column: id (bigint)
NOTICE:  column "sparse_embedding" of relation "hybrid_cleanup_test_body_chunks" already exists, skipping
NOTICE:  Vectorization enabled: hybrid_cleanup_test -> hybrid_cleanup_test_body_chunks
NOTICE:  Strategy: token_based, chunk_size: 100, overlap: 10
NOTICE:  Processing existing rows...
NOTICE:  Processed 0 existing rows
 enable_vectorization 
----------------------
 
(1 row)

-- Verify _idf_stats table exists before disable
SELECT tablename
FROM pg_tables
WHERE tablename = 'hybrid_cleanup_test_body_chunks_idf_stats';
                 tablename                 
-------------------------------------------
 hybrid_cleanup_test_body_chunks_idf_stats
(1 row)

-- Disable with drop
SELECT pgedge_vectorizer.disable_vectorization(
    'hybrid_cleanup_test'::regclass, 'body', true
);
NOTICE:  Vectorization disabled and chunk table dropped: hybrid_cleanup_test_body_chunks
 disable_vectorization 
-----------------------
 
(1 row)

-- Verify _idf_stats table was also dropped
SELECT count(*) AS idf_stats_exists
FROM pg_tables
WHERE tablename = 'hybrid_cleanup_test_body_chunks_idf_stats';
 idf_stats_exists 
------------------
                0
(1 row)

DROP TABLE hybrid_cleanup_test;
---------------------------------------------------------------------------
-- Test 21: multi-column disambiguation error in hybrid_search
---------------------------------------------------------------------------
-- Create a table with two vectorized columns
CREATE TABLE hybrid_multi_test (
    id    BIGSERIAL PRIMARY KEY,
    title TEXT,
    body  TEXT
);
SELECT pgedge_vectorizer.enable_vectorization(
    'hybrid_multi_test'::regclass,
    'title',
    'token_based', 100, 10, 1536
);
NOTICE:  Using primary key column: id (bigint)
NOTICE:  column "sparse_embedding" of relation "hybrid_multi_test_title_chunks" already exists, skipping
NOTICE:  Vectorization enabled: hybrid_multi_test -> hybrid_multi_test_title_chunks
NOTICE:  Strategy: token_based, chunk_size: 100, overlap: 10
NOTICE:  Processing existing rows...
NOTICE:  Processed 0 existing rows
 enable_vectorization 
----------------------
 
(1 row)

SELECT pgedge_vectorizer.enable_vectorization(
    'hybrid_multi_test'::regclass,
    'body',
    'token_based', 100, 10, 1536
);
NOTICE:  Using primary key column: id (bigint)
NOTICE:  column "sparse_embedding" of relation "hybrid_multi_test_body_chunks" already exists, skipping
NOTICE:  Vectorization enabled: hybrid_multi_test -> hybrid_multi_test_body_chunks
NOTICE:  Strategy: token_based, chunk_size: 100, overlap: 10
NOTICE:  Processing existing rows...
NOTICE:  Processed 0 existing rows
 enable_vectorization 
----------------------
 
(1 row)

-- hybrid_search without specifying column should raise
SET pgedge_vectorizer.enable_hybrid = true;
DO $$
BEGIN
    PERFORM pgedge_vectorizer.hybrid_search(
        'hybrid_multi_test'::regclass, 'test query', 5
    );
    RAISE EXCEPTION 'Expected exception was not raised';
EXCEPTION
    WHEN OTHERS THEN
        IF sqlerrm LIKE '%multiple vectorized columns%' THEN
            RAISE NOTICE 'Got expected exception: %', sqlerrm;
        ELSE
            RAISE;
        END IF;
END;
$$;
NOTICE:  Got expected exception: Table hybrid_multi_test has multiple vectorized columns. Pass p_source_column to disambiguate.
RESET pgedge_vectorizer.enable_hybrid;
-- Clean up
SELECT pgedge_vectorizer.disable_vectorization(
    'hybrid_multi_test'::regclass, NULL, true
);
NOTICE:  Dropped trigger: hybrid_multi_test_title_vectorization_trigger
NOTICE:  Dropped trigger: hybrid_multi_test_title_1b7742e4_vectorization_delete_trigger
NOTICE:  Dropped trigger: hybrid_multi_test_title_1b7742e4_vectorization_truncate_trigger
NOTICE:  Dropped trigger: hybrid_multi_test_body_vectorization_trigger
NOTICE:  Dropped trigger: hybrid_multi_test_body_69c04c43_vectorization_delete_trigger
NOTICE:  Dropped trigger: hybrid_multi_test_body_69c04c43_vectorization_truncate_trigger
NOTICE:  Vectorization disabled and chunk table dropped: hybrid_multi_test_title_chunks
NOTICE:  Vectorization disabled and chunk table dropped: hybrid_multi_test_body_chunks
 disable_vectorization 
-----------------------
 
(1 row)

DROP TABLE hybrid_multi_test;
---------------------------------------------------------------------------
-- Test 20: the corpus statistics cache does not change results
---------------------------------------------------------------------------
-- N and the mean document length feed a ranking heuristic, and reading them
-- costs an unindexable scan of the chunk table on every call. Each backend
-- therefore holds them for corpus_stats_cache_ttl seconds. Whatever the
-- setting, the vector produced for a given corpus must be the same, so this
-- compares the two paths directly rather than asserting on either alone.
CREATE TABLE cache_docs (id BIGSERIAL PRIMARY KEY, body TEXT);
INSERT INTO cache_docs (body)
SELECT 'alpha beta gamma document number ' || g FROM generate_series(1, 25) g;
SELECT pgedge_vectorizer.enable_vectorization(
    'cache_docs', 'body', embedding_dimension => 3);
NOTICE:  Using primary key column: id (bigint)
NOTICE:  column "sparse_embedding" of relation "cache_docs_body_chunks" already exists, skipping
NOTICE:  Vectorization enabled: cache_docs -> cache_docs_body_chunks
NOTICE:  Strategy: token_based, chunk_size: 400, overlap: 50
NOTICE:  Processing existing rows...
NOTICE:  Processed 25 existing rows
 enable_vectorization 
----------------------
 
(1 row)

SET pgedge_vectorizer.corpus_stats_cache_ttl = 0;
SELECT pgedge_vectorizer.bm25_query_vector('alpha beta', 'cache_docs_body_chunks')
    AS uncached \gset
SET pgedge_vectorizer.corpus_stats_cache_ttl = 60;
SELECT pgedge_vectorizer.bm25_query_vector('alpha beta', 'cache_docs_body_chunks')
    AS cached \gset
SELECT :'uncached'::sparsevec = :'cached'::sparsevec AS cache_matches_uncached;
 cache_matches_uncached 
------------------------
 t
(1 row)

-- A second table must not read the first one's cached figures.
SELECT pgedge_vectorizer.bm25_avg_doc_len('cache_docs_body_chunks')
    <> pgedge_vectorizer.bm25_avg_doc_len('hybrid_test_docs_content_chunks')
    AS each_table_cached_separately;
 each_table_cached_separately 
------------------------------
 t
(1 row)

RESET pgedge_vectorizer.corpus_stats_cache_ttl;
SELECT pgedge_vectorizer.disable_vectorization('cache_docs', 'body', true);
NOTICE:  Vectorization disabled and chunk table dropped: cache_docs_body_chunks
 disable_vectorization 
-----------------------
 
(1 row)

DROP TABLE cache_docs;
---------------------------------------------------------------------------
-- Test 21: the corpus statistics cache is keyed by relation, not by name
---------------------------------------------------------------------------
-- A chunk table is named unqualified and resolved through search_path, so one
-- string means different relations in a schema-per-tenant deployment. Keyed by
-- name, a pooled backend that switched tenants was handed whichever tenant's
-- corpus it had seen first, and scored the second tenant's queries against the
-- first one's statistics. The two corpora below differ only in document
-- length, so the vectors must differ; keyed by name they came back identical.
CREATE SCHEMA cache_tenant_a;
CREATE SCHEMA cache_tenant_b;
CREATE TABLE cache_tenant_a.t_chunks (id BIGSERIAL PRIMARY KEY, content TEXT,
                                      token_count INT);
CREATE TABLE cache_tenant_b.t_chunks (id BIGSERIAL PRIMARY KEY, content TEXT,
                                      token_count INT);
INSERT INTO cache_tenant_a.t_chunks (content, token_count)
SELECT 'alpha', 10 FROM generate_series(1, 50);
INSERT INTO cache_tenant_b.t_chunks (content, token_count)
SELECT 'alpha', 900 FROM generate_series(1, 50);
CREATE TABLE cache_tenant_a.t_chunks_idf_stats (term TEXT PRIMARY KEY,
                                                doc_freq INT NOT NULL);
CREATE TABLE cache_tenant_b.t_chunks_idf_stats (term TEXT PRIMARY KEY,
                                                doc_freq INT NOT NULL);
INSERT INTO cache_tenant_a.t_chunks_idf_stats VALUES ('alpha', 5);
INSERT INTO cache_tenant_b.t_chunks_idf_stats VALUES ('alpha', 5);
SET pgedge_vectorizer.corpus_stats_cache_ttl = 60;
SET search_path = cache_tenant_a, public;
SELECT pgedge_vectorizer.bm25_query_vector('alpha', 't_chunks') AS tenant_a \gset
SET search_path = cache_tenant_b, public;
SELECT pgedge_vectorizer.bm25_query_vector('alpha', 't_chunks') AS tenant_b \gset
SET search_path = public;
SELECT :'tenant_a'::sparsevec <> :'tenant_b'::sparsevec
    AS same_name_different_schema_not_confused;
 same_name_different_schema_not_confused 
-----------------------------------------
 t
(1 row)

RESET pgedge_vectorizer.corpus_stats_cache_ttl;
DROP SCHEMA cache_tenant_a CASCADE;
NOTICE:  drop cascades to 2 other objects
DETAIL:  drop cascades to table cache_tenant_a.t_chunks
drop cascades to table cache_tenant_a.t_chunks_idf_stats
DROP SCHEMA cache_tenant_b CASCADE;
NOTICE:  drop cascades to 2 other objects
DETAIL:  drop cascades to table cache_tenant_b.t_chunks
drop cascades to table cache_tenant_b.t_chunks_idf_stats
---------------------------------------------------------------------------
-- Cleanup
---------------------------------------------------------------------------
SELECT pgedge_vectorizer.disable_vectorization(
    'hybrid_test_docs'::regclass, 'content', true
);
NOTICE:  Vectorization disabled and chunk table dropped: hybrid_test_docs_content_chunks
 disable_vectorization 
-----------------------
 
(1 row)

DROP TABLE hybrid_test_docs;
